{
  "schemaVersion": "5.0",
  "releaseId": "EM-20000101-EXAMPLE",
  "environment": "production",
  "commitSha": "0000000000000000000000000000000000000000",
  "generatedAt": "2000-01-01T00:00:00Z",
  "expiresAt": "2000-01-01T01:00:00Z",
  "trustedRoots": {
    "path": "evidence/actual/example/trusted-roots.json",
    "sha256": "0000000000000000000000000000000000000000000000000000000000000000",
    "mediaType": "application/json",
    "generatedAt": "2000-01-01T00:00:00Z",
    "releaseId": "EM-20000101-EXAMPLE",
    "commitSha": "0000000000000000000000000000000000000000"
  },
  "repositoryState": {
    "path": "evidence/actual/example/repository-state.json",
    "sha256": "0000000000000000000000000000000000000000000000000000000000000000",
    "mediaType": "application/json",
    "generatedAt": "2000-01-01T00:00:00Z",
    "releaseId": "EM-20000101-EXAMPLE",
    "commitSha": "0000000000000000000000000000000000000000"
  },
  "externalInputs": [
    {
      "name": "APPLE_APP_ATTEST_KEY_SECRET_ARN",
      "verifiedAt": "2000-01-01T00:00:00Z",
      "evidence": {
        "path": "evidence/actual/example/external-inputs/APPLE_APP_ATTEST_KEY_SECRET_ARN.json",
        "sha256": "0000000000000000000000000000000000000000000000000000000000000000",
        "mediaType": "application/json",
        "generatedAt": "2000-01-01T00:00:00Z",
        "releaseId": "EM-20000101-EXAMPLE",
        "commitSha": "0000000000000000000000000000000000000000"
      }
    },
    {
      "name": "AWS_ACCOUNT_ID",
      "verifiedAt": "2000-01-01T00:00:00Z",
      "evidence": {
        "path": "evidence/actual/example/external-inputs/AWS_ACCOUNT_ID.json",
        "sha256": "0000000000000000000000000000000000000000000000000000000000000000",
        "mediaType": "application/json",
        "generatedAt": "2000-01-01T00:00:00Z",
        "releaseId": "EM-20000101-EXAMPLE",
        "commitSha": "0000000000000000000000000000000000000000"
      }
    },
    {
      "name": "AWS_DR_REGION",
      "verifiedAt": "2000-01-01T00:00:00Z",
      "evidence": {
        "path": "evidence/actual/example/external-inputs/AWS_DR_REGION.json",
        "sha256": "0000000000000000000000000000000000000000000000000000000000000000",
        "mediaType": "application/json",
        "generatedAt": "2000-01-01T00:00:00Z",
        "releaseId": "EM-20000101-EXAMPLE",
        "commitSha": "0000000000000000000000000000000000000000"
      }
    },
    {
      "name": "AWS_PRIMARY_REGION",
      "verifiedAt": "2000-01-01T00:00:00Z",
      "evidence": {
        "path": "evidence/actual/example/external-inputs/AWS_PRIMARY_REGION.json",
        "sha256": "0000000000000000000000000000000000000000000000000000000000000000",
        "mediaType": "application/json",
        "generatedAt": "2000-01-01T00:00:00Z",
        "releaseId": "EM-20000101-EXAMPLE",
        "commitSha": "0000000000000000000000000000000000000000"
      }
    },
    {
      "name": "COGNITO_CUSTOMER_POOL_ID",
      "verifiedAt": "2000-01-01T00:00:00Z",
      "evidence": {
        "path": "evidence/actual/example/external-inputs/COGNITO_CUSTOMER_POOL_ID.json",
        "sha256": "0000000000000000000000000000000000000000000000000000000000000000",
        "mediaType": "application/json",
        "generatedAt": "2000-01-01T00:00:00Z",
        "releaseId": "EM-20000101-EXAMPLE",
        "commitSha": "0000000000000000000000000000000000000000"
      }
    },
    {
      "name": "COGNITO_OPERATIONS_POOL_ID",
      "verifiedAt": "2000-01-01T00:00:00Z",
      "evidence": {
        "path": "evidence/actual/example/external-inputs/COGNITO_OPERATIONS_POOL_ID.json",
        "sha256": "0000000000000000000000000000000000000000000000000000000000000000",
        "mediaType": "application/json",
        "generatedAt": "2000-01-01T00:00:00Z",
        "releaseId": "EM-20000101-EXAMPLE",
        "commitSha": "0000000000000000000000000000000000000000"
      }
    },
    {
      "name": "COSIGN_KMS_KEY_ARN",
      "verifiedAt": "2000-01-01T00:00:00Z",
      "evidence": {
        "path": "evidence/actual/example/external-inputs/COSIGN_KMS_KEY_ARN.json",
        "sha256": "0000000000000000000000000000000000000000000000000000000000000000",
        "mediaType": "application/json",
        "generatedAt": "2000-01-01T00:00:00Z",
        "releaseId": "EM-20000101-EXAMPLE",
        "commitSha": "0000000000000000000000000000000000000000"
      }
    },
    {
      "name": "COSIGN_TRUSTED_PUBLIC_KEY_SHA256",
      "verifiedAt": "2000-01-01T00:00:00Z",
      "evidence": {
        "path": "evidence/actual/example/external-inputs/COSIGN_TRUSTED_PUBLIC_KEY_SHA256.json",
        "sha256": "0000000000000000000000000000000000000000000000000000000000000000",
        "mediaType": "application/json",
        "generatedAt": "2000-01-01T00:00:00Z",
        "releaseId": "EM-20000101-EXAMPLE",
        "commitSha": "0000000000000000000000000000000000000000"
      }
    },
    {
      "name": "DATABASE_GENERATION",
      "verifiedAt": "2000-01-01T00:00:00Z",
      "evidence": {
        "path": "evidence/actual/example/external-inputs/DATABASE_GENERATION.json",
        "sha256": "0000000000000000000000000000000000000000000000000000000000000000",
        "mediaType": "application/json",
        "generatedAt": "2000-01-01T00:00:00Z",
        "releaseId": "EM-20000101-EXAMPLE",
        "commitSha": "0000000000000000000000000000000000000000"
      }
    },
    {
      "name": "EKS_ADDON_VERSION_MANIFEST",
      "verifiedAt": "2000-01-01T00:00:00Z",
      "evidence": {
        "path": "evidence/actual/example/external-inputs/EKS_ADDON_VERSION_MANIFEST.json",
        "sha256": "0000000000000000000000000000000000000000000000000000000000000000",
        "mediaType": "application/json",
        "generatedAt": "2000-01-01T00:00:00Z",
        "releaseId": "EM-20000101-EXAMPLE",
        "commitSha": "0000000000000000000000000000000000000000"
      }
    },
    {
      "name": "EKS_CLUSTER_VERSION",
      "verifiedAt": "2000-01-01T00:00:00Z",
      "evidence": {
        "path": "evidence/actual/example/external-inputs/EKS_CLUSTER_VERSION.json",
        "sha256": "0000000000000000000000000000000000000000000000000000000000000000",
        "mediaType": "application/json",
        "generatedAt": "2000-01-01T00:00:00Z",
        "releaseId": "EM-20000101-EXAMPLE",
        "commitSha": "0000000000000000000000000000000000000000"
      }
    },
    {
      "name": "GA1_MODEL_RELEASE_MANIFEST",
      "verifiedAt": "2000-01-01T00:00:00Z",
      "evidence": {
        "path": "evidence/actual/example/external-inputs/GA1_MODEL_RELEASE_MANIFEST.json",
        "sha256": "0000000000000000000000000000000000000000000000000000000000000000",
        "mediaType": "application/json",
        "generatedAt": "2000-01-01T00:00:00Z",
        "releaseId": "EM-20000101-EXAMPLE",
        "commitSha": "0000000000000000000000000000000000000000"
      }
    },
    {
      "name": "ISTIO_CHART_PROVENANCE_EVIDENCE",
      "verifiedAt": "2000-01-01T00:00:00Z",
      "evidence": {
        "path": "evidence/actual/example/external-inputs/ISTIO_CHART_PROVENANCE_EVIDENCE.json",
        "sha256": "0000000000000000000000000000000000000000000000000000000000000000",
        "mediaType": "application/json",
        "generatedAt": "2000-01-01T00:00:00Z",
        "releaseId": "EM-20000101-EXAMPLE",
        "commitSha": "0000000000000000000000000000000000000000"
      }
    },
    {
      "name": "ISTIO_VERSION",
      "verifiedAt": "2000-01-01T00:00:00Z",
      "evidence": {
        "path": "evidence/actual/example/external-inputs/ISTIO_VERSION.json",
        "sha256": "0000000000000000000000000000000000000000000000000000000000000000",
        "mediaType": "application/json",
        "generatedAt": "2000-01-01T00:00:00Z",
        "releaseId": "EM-20000101-EXAMPLE",
        "commitSha": "0000000000000000000000000000000000000000"
      }
    },
    {
      "name": "MAILPIT_IMAGE",
      "verifiedAt": "2000-01-01T00:00:00Z",
      "evidence": {
        "path": "evidence/actual/example/external-inputs/MAILPIT_IMAGE.json",
        "sha256": "0000000000000000000000000000000000000000000000000000000000000000",
        "mediaType": "application/json",
        "generatedAt": "2000-01-01T00:00:00Z",
        "releaseId": "EM-20000101-EXAMPLE",
        "commitSha": "0000000000000000000000000000000000000000"
      }
    },
    {
      "name": "MINIO_IMAGE",
      "verifiedAt": "2000-01-01T00:00:00Z",
      "evidence": {
        "path": "evidence/actual/example/external-inputs/MINIO_IMAGE.json",
        "sha256": "0000000000000000000000000000000000000000000000000000000000000000",
        "mediaType": "application/json",
        "generatedAt": "2000-01-01T00:00:00Z",
        "releaseId": "EM-20000101-EXAMPLE",
        "commitSha": "0000000000000000000000000000000000000000"
      }
    },
    {
      "name": "MODEL_SIGNING_KMS_KEY_ARN",
      "verifiedAt": "2000-01-01T00:00:00Z",
      "evidence": {
        "path": "evidence/actual/example/external-inputs/MODEL_SIGNING_KMS_KEY_ARN.json",
        "sha256": "0000000000000000000000000000000000000000000000000000000000000000",
        "mediaType": "application/json",
        "generatedAt": "2000-01-01T00:00:00Z",
        "releaseId": "EM-20000101-EXAMPLE",
        "commitSha": "0000000000000000000000000000000000000000"
      }
    },
    {
      "name": "OPERATIONS_OIDC_CLIENT_ID_SECRET_ARN",
      "verifiedAt": "2000-01-01T00:00:00Z",
      "evidence": {
        "path": "evidence/actual/example/external-inputs/OPERATIONS_OIDC_CLIENT_ID_SECRET_ARN.json",
        "sha256": "0000000000000000000000000000000000000000000000000000000000000000",
        "mediaType": "application/json",
        "generatedAt": "2000-01-01T00:00:00Z",
        "releaseId": "EM-20000101-EXAMPLE",
        "commitSha": "0000000000000000000000000000000000000000"
      }
    },
    {
      "name": "OPERATIONS_OIDC_CLIENT_SECRET_ARN",
      "verifiedAt": "2000-01-01T00:00:00Z",
      "evidence": {